id,type,text1,text2,text3,text4,notes
valk_inferniumdrive,SHIP_SYSTEM,烈性燃烧剂被注入引擎，极大提升发动机的功率。,进攻,,,
valk_phaseteleporter,SHIP_SYSTEM,瓦尔基里版的空间跃迁，和海波级护卫舰的跃迁别无二致。,机动,,,
valk_burstdrive,SHIP_SYSTEM,瞬时提供引擎加速，将舰船以极速向前推进一段距离。剧烈的碰撞将会使引擎熄火。,机动,瞬时提供引擎加速，将舰船以极速向前推进一段距离。剧烈的碰撞将会使引擎熄火。,,
,,,,,,
valkyrian,FACTION,"女武神组织是这个星域中独立的一个军事大国，他们曾是人之领的一部分，星图上充满谜团的一角。经过对人之领核心技术数年的私下研究后，他们通过这些被破解的知识进而武装自己，并渐渐的成为了舰船设计界强劲又值得尊敬的大型组织，拥有着远超私企与海军的舰船设计能力。

然而，简单地学习蓝图，然后进行改进已经无法满足他们，随着越来越多的先进技术被藏匿起来，他们开始用愈发狂热的手段来满足自己的优越感。最终他们由于与人之领开发部门产生了激烈的冲突，并断绝了关系。当人之领的王权注意到他们的威胁日益增显并实行镇压时，他们决定会用自己的方式来摧毁阻挡他们寻求力量的道路的敌人。

为了最终摆脱人之领的控制，他们倾注所有的生产力来制造舰载星门。这允许他们在没有星门的情况下，只要在相应星系驻扎着装备有星门驱动的超级舰队，就可以进行亚空间旅行。他们现在聚居在宇宙的大部分空间中。其中一些地方崩溃或被遗忘后成为了失落的世界。他们最终以自己的方式发现了英仙座，并跻身争夺该地文明控制权的竞争行列中。",,,,
valk_boostrefit,SHIP_SYSTEM,航母整备速率的衰减速度及战机更换时间减少三分之一，并且回程战机的速度、机动加倍。使用产生大量幅能。,进攻,,,
,,,,,,
valk_planet_enigma_i,CUSTOM," 瓦尔基里 的首都。通行星域的王家政令，都出自此地。

大崩溃前盘踞在当地的矿物企业为 女武神组织 留下了规模庞大的工业基础。在其遗产之上孵化出的奥肯制造集团和谜团公司，以及其他中小型企业，代表了整个 女武神组织 的实体经济，现代化改造时期收回的外部资本进一步刺激了当地经济的发展。

这里作为 瓦尔基里 战争工厂的重要性不言而喻，轨道基地中常年驻扎着三艘王家巡洋舰，保持战备状态以应对突发情况。",,这里充斥着强烈的雌性荷尔蒙气息， 放眼所见的高管几乎全是女性。而男人们则在码头上干着杂活，时不时你还能看到皮鞭狠狠地落在他们身上。,,
valk_station_enigma_i,CUSTOM,高悬的轨道防御设施，与作为近地防御的天空要塞不同，该设施内部有着大量生产设施，可以做到自给自足。庞大的港口系泊着主力舰，在 女武神组织 南征北战的辉煌岁月里，这一巨物默默地注视了一代代远征舰队的驶去。,,,,
valk_planet_enigma_i_moon,CUSTOM,"凄凉的风呼啸在这颗杂乱的卫星上，已经很多年没有船驶近这一地带。Enigma I上没有人能说得清个中缘由，这个枯萎的行星通常被人所忽视。

瓦尔基里 王室档案馆所记载最近的一次调查要追溯到14年前，人们在这个死亡世界发现了一条线索——废墟的某处，不明生物的尸骸散乱排列，堆成令人费解的形状，似乎与 女武神 最古老而可怖的宿敌有所关联。",,,,
valk_planet_enigma_ii,CUSTOM,"女武神组织 下属的矿业世界，现代化改造后，随着势力外缘的急剧萎缩，这一地区在 瓦尔基里 世界中占据了越来越重要的地位。

得益于富饶的矿床，和赤道上永远喷薄的挥发物涌泉，这个世界满足着女武神的星际舰队和战争机器贪得无厌的胃口。 这里与光鲜亮丽的Enigma I不同，大多数人口靠苦力劳动为生，境遇十分悲惨。",,,,
